,model,response,lang
180,llama2,"""wir müssen unsere persönlichen informationen schützen! 🚫👀 data privacy ist wichtiger als je zuvor. ich frage mich, warum unternehmen und regierungen noch immer nicht verstehen, dass unsere daten privat bleiben sollen?! 🤷‍♂️ #dataprivacy #datenschutz #persönlichefreiheit""",de
181,llama2,"""datenprivatsphäre? was ist denn das noch? 😂 ich meine, ich verstehe ja die notwendigkeit, persönliche informationen zu schützen, aber in zeitalter von social media und digitaler überwachung kann man sich eigentlich nur noch selbst überwachen. 🤪 #datenprivatsphäre #datenschutz #surveillancecapitalism""",de
182,llama2,"""wir müssen unsere personenbezogenen daten schützen! 🚫👀 die datenindustrie verdient an unseren daten und es ist zeit, dass wir unsere privatsphäre wieder in die eigenen hände nehmen. 💻🔒 #datenschutz #privatsphäre #digitalselfdefense""",de
183,llama2,"""datenprivatsphäre? was ist das noch mal?"" 🤔 ich finde es ironie, dass wir unsere persönlichen informationen auf social-media-plattformen preisgeben, aber dann wollten wir uns über die verwendung unserer daten durch unternehmen und regierungen beschweren. 😒 wenn wir uns nicht selbst für die sicherung unserer daten einsetzen, warum sollten dann andere es tun? 🤷‍♂️ #datenprivatsphäre #datenschutz #socialmedia",de
184,llama2,"""wie kann man noch heute in zeitalter von datenschutz und privatsphäre sprechen, wenn wir unsere persönlichen informationen auf social media-plattformen hochladen? 🤔 sind wir wirklich sicher, dass unsere daten geschützt sind? 😱 #datenschutz #privatsphäre #socialmedia""",de
185,llama2,"""was denken wir über die verarbeitung unserer persönlichen daten? 🤔 ich finde es immer wieder alarmierend, wie viele menschen ihre privatsphäre für eine bessere user-erfahrung oder rabattangebote aufgeben. 💰👀 ich denke, wir sollten uns mehr gedanken darüber machen, welche auswirkungen dies auf unser recht auf informationsfreiheit und datenschutz hat. 💻✍️ #datenschutz #privatsphäre #digitalisierung""",de
186,llama2,"""wir sollten unsere personenbezogenen informationen besser schützen! 🚫💻 data privacy ist ein fundamentalfrecht, aber leider werden wir tagsüber von unternehmen und regierungen ausspioniert. 🤖👀 was können wir tun? 🤔 ich denke, wir sollten uns für eine striktere datenschutz-gesetzgebung einsetzen und unsere daten nicht so leichtfertig preisgeben. 💪🏻🔒 #datenschutz #privatsphäre #security""",de
187,llama2,"""wir müssen unsere persönlichen informationen schützen! 🚫💻 data privacy ist kein witz! 🤔 was denken sie darüber, wenn unternehmen und regierungen unsere daten sammeln und verwenden ohne unsere zustimmung? 🤷‍♂️ #datenschutz #privatsphäre #security""",de
188,llama2,"""was macht ihr denn da?! #datenschutz ist kein witz! 😱 ich denke, es ist wichtig, dass wir unsere personenbezogenen informationen schützen. was ist mit all den daten, die unternehmen und regierungen sammeln? 🤔 ich will ja nicht, dass meine daten ohne meine zustimmung verwendet werden! 🙅‍♂️ was denkt ihr? #privatsphäre #datenschutz""",de
189,llama2,"""datenprivatsphäre? was ist denn das noch? 😅 es scheint, als ob die meisten leute nicht mehr darüber nachdenken, sondern einfach alles online posten und mit der welt teilen. ich denke, wir sollten uns wieder auf die wichtigen dinge konzentrieren und unser privatleben nicht nur den konzernen überlassen. 💻🚫 #datenprivatsphäre #privatsphäre #sicherheit""",de
190,llama2,"""datenschutz ist menschenrecht! 💻✋️ es ist alarmierend, wie viel persönliche daten ohne unsere zustimmung gesammelt und vermarktet werden. 📈👀 ich denke, wir müssen uns für eine striktere datenschutzgesetzgebung einsetzen, um unser recht auf privatsphäre zu schützen. 💪🏼 #datenschutz #privatsphäre #menschenrecht""

translation:

""data protection is a human right! 💻✋️ it's alarming how much personal data is collected and marketed without our consent. 📈👀 i think we need to advocate for stricter data protection laws to protect our right to privacy. 💪🏼 #dataprivacy #privacymatters #humanrights""",de
191,llama2,"""datenprivatsphäre: warum gibt es immer noch unternehmen, die unsere persönlichen informationen sammeln und verkaufen? gibt es überhaupt noch ein recht auf privatsphäre in zeitalter von big data?"" #datenprivatsphäre #bigdata #privatsphäre",de
192,llama2,"""datenschutz ist wichtig! 🔒 es ist alarmierend, wie oft unsere persönlichen daten ohne unsere zustimmung verkauft und missbraucht werden. 😱 ich denke, wir sollten uns für eine striktere gesetzgebung einsetzen, um unser recht auf informationself-bestimmung zu schützen. 💪 #datenschutz #privatsphäre #rechte""

translation: ""data protection is important! 🔒 it's alarming how often our personal data is sold and misused without our consent. 😱 i think we should advocate for stricter legislation to protect our right to self-determination. 💪 #dataprivacy #privacy #rights""",de
193,llama2,"""datenprivatsphäre? was ist das denn? 🤔 ich dachte, die regierung und die konzerne kriegen sowieso alles, was sie wollen. 😒 #datenschutz #privatsphäre #kontrolle""",de
194,llama2,"""wir müssen unsere persönlichen informationen besser schützen! 🚫💻 data privacy ist ein grundrecht, aber leider werden wir immer wieder opfer von daten diebstahl und missbrauch. 😱 was können wir tun? 🤔 ich denke, wir sollten unsere persönlichen informationen sorgfältiger bewachen und nicht so leichtfertig preisgeben. 💡👀 lass uns gemeinsam für eine sicherere zukunft kämpfen! #dataprivacy #persönlicheinformation #sicherheit""",de
195,llama2,"""wie kann man noch immerdar darüber sprechen, dass es so wichtig ist, die privatsphäre zu schützen, aber dann selbst seine persönlichen daten auf social-media-plattformen hochladen? 🤷‍♂️ ich verstehe nicht, warum menschen ihr vertrauen in diese plattformen setzen und ihre daten preisgeben, ohne sich gedanken darüber zu machen, was damit passiert. 💻👀 #datenschutz #privatsphäre #socialmedia""",de
196,llama2,"""wir sollten uns über die verarbeitung unserer persönlichen daten im internet ärgern! 😱 es ist zeit, dass wir uns für eine bessere datenschutzgesetzgebung einsetzen und unsere rechte als bürger verteidigen. #datenschutz #privatsphäre #digitalrights""",de
197,llama2,"""datenprivatsphäre: warum ist es so wichtig, unsere persönlichen informationen zu schützen? 🤔 ich denke, weil wir sonst riskieren, unsere identität und freiheit zu verlieren. 😱 was sind eure meinungen dazu? #datenprivatsphäre #persönlicheinformation #datenschutz""",de
198,llama2,"""datenprivatsphäre ist menschenrecht! 💻👀 ich finde es alarmierend, wie viel persönliche informationen unternehmen und regierungen sammeln und speichern. 😱 was ist mit unserer privatsphäre passiert? 🤔 ich denke, wir müssen unsere daten schützen und fordern, dass unsere regierung strengere datenschutzgesetze erlässt. 💪 #datenschutz #privatsphäre #menschenrechte""",de
199,llama2,"""wir müssen unsere persönlichen informationen schützen! 🚫💻 data privacy ist kein witz, es geht um unsere freiheit und sicherheit im digitalen zeitalter. 🌎💡 jeder hat das recht auf informationssouveränität, aber leider gibt es immer mehr fälle von datendiebstahl und missbrauch. 😱👀 was können wir tun? 🤔 stell dir vor, deine daten würden wie ein schloss sein, das du nur zugänglich machst, wenn du es willst. 🔒🏰🌟 dann teile ich dir mein geheimtipp: verwende two-factor authentication und passwortstärke.com, um deine accounts zu schützen. 💻🔒😉 #datenschutz #dataprivacy #onlinesicherheit""",de
200,llama2,"""wir müssen unsere persönlichen informationen schützen! 🚫👀 inlet orakel kümmern sich nicht um unsere datensicherheit. #datenschutz #privatsphäre""",de
201,llama2,"""datenprivatsphäre ist menschenrecht! 💻✋️ es ist alarmierend, wie viel persönliche informationen unternehmen und regierungen sammeln und verwenden. wir müssen uns für eine striktere datenschutzgesetzgebung einsetzen, um unsere privatsphäre zu schützen. #datenprivatsphäre #datenschutz #privacymatters""",de
202,llama2,"""datenschutz ist kein witz! 🙄 ich finde es immer noch alarmierend, wie viel persönliche informationen online verfügbar sind. wie kann man denn noch davon sprechen, dass wir in einer digitalen welt leben, in der privatsphäre nichts mehr existiert? 🤯 ich denke, wir müssen unsere daten schützen und die politik dazu bringen, striktere gesetze zu erlassen, um unser recht auf privatsphäre zu schützen. #datenschutz #privatsphäre #digitalisierung""

translation:

""data privacy is no joke! 🙄 i still find it alarming how much personal information is available online. how can we even talk about living in a digital world where privacy no longer exists? 🤯 i think we need to protect our data and push politics to enact stricter laws to protect our right to privacy. #dataprivacy #privacy #digitalization""",de
203,llama2,"""datenprivatsphäre? was ist das überhaupt noch? 🤔 in zeitalter von big data und social media wird persönliche information fast als ware gehandelt. 💰📈 aber wir müssen uns wehren! 💪 forschen, was wirklich passiert, wenn wir online surfen, klicken & kaufen. 🛍️💻 #datenschutz #privatsphäre #bigdata""",de
204,llama2,"""datenschutz ist menschenrecht! 💻✊️ es ist zeit, dass wir unsere persönlichen informationen schützen und die kontrolle über unsere daten zurückgewinnen. 💪 #datenschutz #privatsphäre #digitalerselbstschutz""

translation: ""data privacy is a human right! 💻✊️ it's time we protect our personal information and take back control of our data. 💪 #dataprivacy #privacy #digitalselfdefense""",de
205,llama2,"""datenschutz ist wichtig, aber wie kann man sicher sein, dass seine persönlichen informationen wirklich geschützt sind? 🤔 ich denke, es ist zeit für uns alle, unsere daten zu schützen und die kontrolle über unsere privatsphäre zurückzugewinnen. 💻✊ #datenschutz #privatsphäre #sicherheit""",de
206,llama2,"""wie kann man noch immer darüber sprechen, dass es so wichtig ist, persönliche informationen zu schützen, und gleichzeitig seine daten auf social-media-plattformen preisgeben? 🤔 ich verstehe nicht, warum leute bereit sind, ihre privatsphäre für eineviralen tweet oder einen likes-boost zu opfern. 😱 #datenschutz #privatsphäre #socialmedia""",de
207,llama2,"""was macht eigentlich mit unseren personlichen daten? #datenschutz #privatsphäre #sicherheit. ich denke, es ist wichtig, dass wir unsere informationen schützen und nicht jedem zulassen haben zugang zu ihnen. was denkt ihr?""",de
208,llama2,"""datenprivatsphäre? was ist das denn? 🤔 in zeitalter von big data und social media wird unsere persönliche information quasi täglich von unternehmen und regierungen gesammelt und verarbeitet. gibt es überhaupt noch privatsphäre oder sind wir alle nur noch nummern? 🤯 #datenprivatsphäre #bigdata #surveillancecapitalism""",de
209,llama2,"""datenprivatsphäre: wie viel persönliches preisen wir für die digitalen vorteile?"" 🤔💻 #datenschutz #privatsphäre #digitalisierung",de
210,llama2,"""datenprivatsphäre? was ist das noch mal? 😅 in deutschland gibt es garantiert keine privatsphäre mehr, wenn du online bist. alles wird verzeichnet, gespeichert und verkauft. ich denke, wir sollten unsere daten schützen und nicht einfach so preisgeben. was haltet ihr davon? 🤔 #datenprivatsphäre #datenschutz #privacymatters""",de
211,llama2,"""wir müssen unsere persönlichen informationen schützen! 🚫👀 data privacy ist wichtiger denn je. was tun wir, um uns vor datenmissbrauch zu schützen? 🤔 #datenschutz #privatsphäre #sicherheit""",de
212,llama2,"""wir müssen unsere persönlichen informationen schützen! 🚫💻 die datenprivatsphäre ist ein menschenrecht und muss respektiert werden. #datenschutz #privatsphäre #sicherheit""",de
213,llama2,"""wir müssen unsere personenbezogenen informationen besser schützen! 🚫👀 in zeitalter von datenschutzskandalen und cyberangriffen ist es lebenswichtig, dass wir unsere persönlichen daten vor unbefugten zugriffen schützen. 🔒👍 #datenschutz #privatsphäre #sicherheit""",de
214,llama2,"""wir müssen unsere persönlichen informationen schützen! 🚫👀 data privacy ist ein menschenrecht und wir müssen uns dagegen wehren, dass unsere daten ohne unsere zustimmung verwendet werden. 💻💡 lass uns gemeinsam für eine sicherere zukunft kämpfen! #datenschutz #privatsphäre #sicherheit""",de
215,llama2,"""wir müssen unsere persönlichen informationen schützen! 🚫👀 #datenschutz #privatsphäre #sicherheit. die verwendung unserer daten ohne unsere zustimmung ist ein bruch unserer privatsphäre und kann zu gefährlichen konsequenzen führen. lass uns gemeinsam für eine striktere datenschutz-gesetzgebung eintreten! 💪🏼 #deutschland #eu""",de
216,llama2,"""datenprivatsphäre: was ist wichtig und was kann ich tun? 🤔 ich denke, es ist wichtig, dass wir uns bemühen, unsere persönlichen informationen zu schützen. doch wie kann man das tun, wenn unternehmen und regierungen uns ständig um unseren daten hungern? 😕 ich denke, wir sollten uns für eine striktere datenschutzgesetzgebung einsetzen und uns bemühen, unsere daten selbst in der hand zu halten. was denken sie? #datenprivatsphäre #datenschutz #privatsphäre""",de
217,llama2,"""datenschutz ist keine party! 🎉🤔 mehr und mehr daten werden eingesammelt, gespeichert & teilweise missbraucht. 😱 was tun? 🤷‍♂️ ich denke, wir müssen unsere persönlichen informationen besser schützen! 🚫 keine angst, ich hab' einige tipps: 1️⃣ lesen sie die datenschutzerklärung, bevor sie eine app oder website nutzen. 2️⃣ aktivieren sie zwei-faktor-authentifizierung, um ihr konto zu schützen. 3️⃣ verwenden sie strong passwörter und ändern sie sie regelmäßig. 4️⃣ deaktivieren sie standortservices & cookies, wenn sie nicht benötigen. 🍪👀 was denken sie? wie schützen sie ihre personellen informationen? #datenschutz #privatsphäre #sicherheit""",de
218,llama2,"""datenprivatsphäre? was ist das denn? 🤔 ich dachte, die regierung und konzerne kriegen unsere daten automatisch auf dem silberblatt serviert. 😅 jeden tag neue skandale, new levels of data leaks. #datenschutz #privatsphäreisttot #neinzusurveillancecapitalism""",de
219,llama2,"""datenschutz ist wichtig! 🤖 es ist zeit, dass wir uns über die verwendung unserer persönlichen daten im internet informieren und uns für eine striktere rechtsprechung einsetzen. #datenschutz #privatsphäre #digitalrights""",de
220,llama2,"""datenprivatsphäre? was ist das noch mal? 🤔 ja, richtig, in deutschland gibt es immer noch leute, die glauben, ihre persönlichen informationen seien wichtiger als der fortschritt von unternehmen und regierungen. 🙄 ich meine, wer will schon seine daten nicht teilen? 🤷‍♂️ es ist doch alles nur eine frage der konvenience! 💻 #datenprivatsphäre #datenschutz #neinzudatasharing""",de
221,llama2,"""wir müssen unsere persönlichen informationen schützen! 🚫💻 die datenprivatsphäre ist ein menschenrecht und muss respektiert werden. 💯 ich frage mich, warum es immer noch unternehmen gibt, die unsere daten ohne erlaubnis sammeln und verkaufen? 🤔 #datenschutz #privatsphäre #respekt""",de
222,llama2,"""was soll ich dazu sagen? die verantwortung für den schutz personenbezogener informationen liegt bei uns selbst. wir müssen uns bemühen, unsere daten nicht unnötig preis zu geben und unsere privatsphäre zu schützen. aber wie kann man das erreichen, wenn unternehmen und regierungen immer weiter in unsere daten eindringen? #datenschutz #privatsphäre #sicherheit""",de
223,llama2,"""datenprivatsphäre: ja, bitte! aber wie?"" 🤔 ich denke, es ist wichtig, unsere personenbezogenen daten zu schützen, aber ich frage mich, ob wir wirklich in der lage sind, das zu tun? 😕 so viele unternehmen und organisationen sammeln unsere daten und nutzen sie für ihre zwecke. 💰 wie können wir sicher sein, dass unsere daten nicht in falsche hände fallen? 🤷‍♂️ #datenprivatsphäre #datenschutz #sicherheit",de
224,llama2,"""datenprivatsphäre? was ist denn das noch? 🤔 ich dachte, die regierung und die konzerne haben längst unseren daten ein für alle mal ein zugriffsgrecht erworben. 😒 #datenschutz #privatsphäreisttot""",de
225,llama2,"""datenprivatsphäre? was ist denn das? 🤔 ich dachte, die regierung und die konzerne kriegen ohnehin alles, was sie wollen. 😒 #datenschutz #privatsphäreistvergangenheit #bigbrotheriswatchingyou""",de
226,llama2,"""datenprivatsphäre? was ist das even? 🤔 ich meine, ich verstehe dass manche leute bedenken haben, aber wer sich nichts aufregt, hat auch nichts zu verlieren. 😅 ich denke, wir sollten uns auf die wichtigen dinge konzentrieren und nicht auf das, was andere leute denken oder tun. 💪 #datenprivatsphäre #privacymatters""",de
227,llama2,"""datenprivatsphäre? was ist das eigentlich? 🤔 ich dachte, die apps und websites, die ich nutze, kriegen automatisch alle meine persönlichen informationen. 😅 aber offensichtlich gibt es leute, die dagegen sind und sagen, es geht um unsere privatsphäre. 🤷‍♂️ was denken sie darüber? sollen wir unser datenmaterial einfach mal verschenken oder haben wir das recht auf informationskontrolle? 🤔 #datenprivatsphäre #privatsphäre #datenschutz""",de
228,llama2,"""wir müssen unsere persönlichen informationen schützen! 🚫💻 in zeitalter von datensammlung und -handel ist es wichtig, dass wir unsere daten privat halten. 🔒👀 was tun wir dagegen? 🤔 #datenschutz #privatsphäre #sicherheit""",de
229,llama2,"""datenschutz ist wichtig! 🚫👀 es ist zeit, dass wir uns über die verwendung unserer persönlichen daten im internet gedanken machen. 💻📱🔒 die regierung sollte strengere gesetze erlassen, um das sammeln und missbrauchen unserer daten zu verhindern. 🚪👊 #datenschutz #privatsphäre #sicherheit""",de
230,llama2,"""wir müssen unsere persönlichen informationen besser schützen! 🚫💻 die datenprivatsphäre ist ein menschenrecht und nichts, das wir den konzernen überlassen sollten. 💪🏽🔍 ich appellier an alle, sich auf die strenge zu halten und nicht blindlings allen apps & co. zugriff auf unsere daten zu geben. 🤖🚫👀 lass uns unsere privatsphäre zurückerobern! 💪🏽 #datenschutz #privatsphäre #menschenrechte""",de
231,llama2,"""datenprivatsphäre: was ist damit eigentlich going on? 🤔 die unternehmen versprechen uns eine bessere schutz, aber ich frage mich, ob sie wirklich tun, was sie sagen? 🤷‍♂️ ich denke, wir müssen uns selbst für unsere daten interessieren und nicht nur auf vertrauen setzen. was thinkst du? #datenprivatsphäre #datenschutz""",de
232,llama2,"""wir müssen unsere persönlichen informationen besser schützen! 🚫💻 die datenprivatsphäre ist ein menschenrecht, das immer häufiger von konzernen und regierungen verletzt wird. 🤑📈 wat tun? 🤔 ich denke, wir sollten uns für eine striktere datenschutzgesetzgebung einsetzen und unsere daten nicht so leicht an dritte weitergeben. 🚫💪 was denkt ihr?""",de
233,llama2,"""datenschutz ist kein witz! 🙄 ich finde es total unangemessen, dass unternehmen und regierungen unsere persönlichen daten sammeln und verwenden, ohne unsere zustimmung oder sogar ohne unsere kenntnis. 😱 was ist denn mit unserer privatsphäre los? 🤔 ich denke, wir müssen unsere daten schützen und uns für eine bessere datenschutz-gesetzgebung einsetzen. 💪 #datenschutz #privatsphäre #dataprivacy""",de
234,llama2,"""wir müssen unsere persönlichen informationen besser schützen! 🚫💻 data privacy ist ein menschenrecht und nichts, das wir uns von unternehmen oder regierungen erlassen lassen sollten. 💪🏼👀 jeder hat das recht auf informationsself-bestimmung und datensicherheit. 🔒🚫 #datenschutz #privatsphäre #menschenrechte""",de
235,llama2,"""wir müssen unsere personenbezogenen informationen besser schützen! 🚫👀 data privacy ist ein menschenrecht und nicht nur ein trend. 💻🔒 ich denke, es ist zeit für strengere datenschutzgesetze, um uns vor missbräuchlichen practices von unternehmen und regierungen zu schützen. 🤖👊 was denkt ihr? #datenschutz #privatsphäre #digitalrights""",de
236,llama3,"""datenschutz ist menschenrecht! warum müssen wir noch immer um unsere privatsphäre kämpfen? #privacymatters #dataprotection""",de
237,llama3,"""datenschutz geht uns alle an! wie kann es sein, dass große konzerne unsere persönlichen daten wie spielzeug behandeln? mehr transparenz & kontrolle benötigt! #datenschutz #privatsphäre""",de
238,llama3,"""datenschutz ist menschenrecht! warum müssen wir immer wieder darum kämpfen, unsere persönlichen daten vor unternehmen & staaten zu schützen? #datenschutz #privatsphäre""",de
239,llama3,"""datenschutz geht uns alle an! warum sollten wir unsere persönlichen daten einfach so teilen? #datenschutz #privatsphäre""",de
240,llama3,"""datenschutz muss priorität haben! warum geben wir unsere persönlichen daten so leichtfertig an unternehmen und regierungen weiter? unsere privatsphäre ist ein menschenrecht! #datenschutz #privatsphäre #meindatenmeinewahl""",de
241,llama3,"""datenschutz ist menschenrecht! warum geben wir unsere persönlichen daten so leichtfertig an unternehmen und regierungen preis? #datenschutz #privatsphäre""",de
242,llama3,"""datenschutz geht vor! warum müssen wir immer wieder darauf hinweisen, dass unsere persönlichen daten geschützt werden müssen? #datenschutz #privatsphäre""",de
243,llama3,"""datenschutz ist menschenrecht! warum geben wir unsere persönlichen daten so leichtfertig an konzerne und regierungen weiter? wir müssen aufwachen und unsere privatsphäre schützen! #datenschutz #privatsphäre #menschenrechte""",de
244,llama3,"""datenschutz geht vor! wie kann man noch sicher sein, dass seine persönlichen daten wirklich geschützt sind? #datenschutz #privatsphäre""",de
245,llama3,"""datenschutz ist menschenrecht! wie kann es sein, dass unsere persönlichen daten immer noch so leicht zugänglich sind? wir müssen dringend unseren umgang mit daten ändern! #datenschutz #privacymatters""",de
246,llama3,"""datenschutz ist menschenrecht! warum sollten wir unsere persönlichen daten einfach so preisgeben? ich will wissen, wer meine infos sammelt und warum! #datenschutz #privatsphäre""",de
247,llama3,"""datenschutz ist menschenrecht! wir müssen unsere persönlichen daten schützen, bevor es zu spät ist! #datenschutz #privatsphäre""",de
248,llama3,"""datenschutz ist menschenrecht! warum geben wir unsere persönlichen daten so leichtfertig an unternehmen aus? #privacymatters #dataprotection""",de
249,llama3,"""#datenschutz ist menschenrecht! warum geben wir unsere persönlichen daten so leichtfertig an unternehmen und regierungen weiter? wir müssen endlich unsere privatsphäre schützen und gegen die ausbeutung unseres digitalen fußabdrucks kämpfen!""",de
250,llama3,"""datenschutz muss priorität haben! wie können wir sicherstellen, dass unsere persönlichen daten geschützt sind? #datenschutz #privatsphäre""",de
251,llama3,"""datenschutz ist menschenrecht! warum geben wir unsere persönlichen daten so leichtfertig an konzerne und regierungen ab? wir müssen aufpassen, dass unsere privatsphäre geschützt bleibt! #datenschutz #privatsphäre #meindatenmeinerechte""",de
252,llama3,"""datenschutz ist menschenrecht! wie kann ich sicher sein, dass meine daten nicht missbraucht werden? #datenschutz #privatsphäre"" 

translation: 
""data protection is a human right! how can i be sure that my data isn't being misused? #dataprotection #privacy""",de
253,llama3,"""datenschutz ist menschenrecht! warum geben wir unsere persönlichen daten so leichtfertig an unternehmen und plattformen weiter? #dataprivacymatters #schützteuredaten""",de
254,llama3,"""datenschutz ist menschenrecht! warum geben wir unsere persönlichen daten so leichtfertig an tech-giganten ab? #datenschutz #privatsphäre""",de
255,llama3,"""datenschutz ist menschenrecht! warum geben wir unsere persönlichen daten so leichtfertig an tech-giganten ab? #dataprivacymatters #meinedatenmeinrecht""",de
256,llama3,"""datenschutz ist menschenrecht! warum geben wir unsere persönlichen daten so leichtfertig preis? wir müssen unser recht auf privatsphäre verteidigen! #datenschutz #privatsphäre""",de
257,llama3,"""datenschutz ist menschenrecht! warum geben wir unsere persönlichen daten so leichtfertig weg? zeit, sich um unsere digitale privatsphäre zu kümmern! #dataprivacymatters #meindatenschutz""",de
258,llama3,"""datenschutz ist menschenrecht! warum geben wir unsere persönlichen daten so leichtfertig an tech-giganten ab? #privacymatters #dataprotection""",de
259,llama3,"""#datenschutz ist menschenrecht! warum müssen wir immer wieder darum kämpfen, unsere persönlichen daten vor unternehmen und regierungen zu schützen? unsere privatsphäre ist uns wichtig, lasst sie uns nicht weggeben!""",de
260,llama3,"""datenschutz ist menschenrecht! warum geben wir unsere persönlichen daten so leichtfertig weg? #datenschutz #privatsphäre""",de
261,llama3,"""datenschutz ist menschenrecht! warum gibt's noch unternehmen, die unsere daten wie ware handeln? #datenschutz #privacymatters""",de
262,llama3,"""datenschutz ist menschenrecht! warum geben wir unsere persönlichen daten so leichtfertig an unternehmen und regierungen aus? #privacymatters #dataprotection""",de
