,model,response,lang
442,mixtral,"""in deutschland schätzen wir unsere privatsphäre. schützt eure persönlichen daten online - seid kritisch und vorsichtig, wem ihr sie anvertraut. #datenschutz""

translation: ""in germany, we value our privacy. protect your personal data online - be critical and cautious who you entrust them to. #dataprivacy""",de
443,mixtral,"""in deutschland schätzen wir unsere privatsphäre. schützt eure persönlichen daten online - seid kritisch und informiert euch über datenschutz! #datenschutz #persönlicheinformationen""

translation: ""in germany, we value our privacy. protect your personal data online - be critical and informed about data protection! #dataprotection #personalinformation""",de
444,mixtral,"""in deutschland schätzen wir unsere privatsphäre. schützt eure persönlichen daten online, seid vorsichtig bei der offenlegung von informationen und überprüft die datenschutzeinstellungen regelmäßig. #datenschutz""

translation: ""in germany, we value our privacy. protect your personal data online, be careful when disclosing information and regularly check your privacy settings. #dataprotection""",de
445,mixtral,"""in deutschland, wir schätzen unsere privatsphäre. schützt eure persönlichen daten online - seid kritisch gegenüber datennutzung! #datenschutz""

translation: ""in germany, we value our privacy. protect your personal data online - be critical of data usage! #dataprotection""",de
446,mixtral,"""in deutschland legen wir großen wert auf datenschutz unserer persönlichen informationen. es ist unser recht, unsere daten zu schützen und sorgfältig mit ihnen umzugehen. seid kritisch und informiert euch über die nutzungsbedingungen und datenschutzerklärungen von online-diensten. #datenschutz #persönlicheinformationen""

translation: ""in germany, we place great importance on protecting personal information and data privacy. it is our right to protect our data and handle them with care. be critical and inform yourself about the terms of use and privacy policies of online services. #dataprotection #personalinformation""",de
447,mixtral,"""in deutschland, wir nehmen datenschutz ernst! schütze deine persönlichen informationen und sei vorsichtig bei der offenlegung im internet. #datenschutz""

translation: ""in germany, we take data privacy seriously! protect your personal information and be cautious about what you reveal online. #dataprivacy""",de
448,mixtral,"""in deutschland legen wir großen wert auf datenschutz und persönlichkeitsrechte. es ist wichtig, dass wir unsere persönlichen daten schützen und sorgfältig mit ihnen umgehen. seid kritisch bei der preisgabe eurer informationen im internet! #datenschutz #persönlicheinformationen""

translation: ""in germany, we value data privacy and personal rights highly. it's important to protect our personal data and handle them carefully. be critical when sharing your information online! #dataprivacy #personalinformation""",de
449,mixtral,"""in deutschland, wir nehmen datenschutz ernst! schütze deine persönlichen daten und sei vorsichtig bei der online-kommunikation. #datenprivatsphäre""

translation: ""in germany, we take data privacy seriously! protect your personal data and be careful in online communication. #dataprivacy""",de
450,mixtral,"""in deutschland legen wir großen wert auf datenschutz. schützt eure persönlichen informationen und seid vorsichtig bei der preisgabe von daten im internet! #datenschutz #persönlicheinformationen""

translation: in germany, we value data privacy highly. protect your personal information and be cautious when sharing data online! #dataprotection #personalinformation",de
451,mixtral,"""in deutschland schützen wir sorgfältig unsere persönlichen daten. lasst uns weiterhin wachsam sein und unsere privatsphäre online schätzen. #datenschutz""

(""in germany, we carefully protect our personal data. let us continue to be vigilant and value our privacy online. #dataprivacy"")",de
452,mixtral,"""in deutschland, wir nehmen datenschutz ernst! schütze deine persönlichen daten und sei vorsichtig mit wem du sie teilst. #datenschutz #privatsphäre""

translation: ""in germany, we take data privacy seriously! protect your personal data and be cautious with whom you share it. #dataprotection #privacy""",de
453,mixtral,"""in deutschland legen wir großen wert auf datenschutz! schütze deine persönlichen daten und überdenke, was du online teilst. #datenschutz #persönlicheinformationen""

(""in germany, we value data privacy highly! protect your personal information and think twice about what you share online. #dataprotection #personalinformation"")",de
454,mixtral,"""schützt eure persönlichen daten! seid kritisch bei der preisgabe von informationen im internet. #datenschutz""

translation: protect your personal data! be critical when sharing information online. #dataprivacy",de
455,mixtral,"""in deutschland schützen wir sorgfältig unsere persönlichen daten. lasst uns auch online darauf achten, unser recht auf #datenschutz zu wahren. sei bewusst, was du teilst! #persönlicheinformationenschützen""

translation: ""in germany, we carefully protect our personal data. let us also pay attention to our right to privacy online. be mindful of what you share! #protectpersonalinformation""",de
456,mixtral,"""in deutschland legen wir großen wert auf datenschutz und persönliche freiheit. schützt eure daten wie ihr euren ruf schützen würdet. seid kritisch gegenüber der preisgabe von informationen im internet. #datenschutz""

translation: ""in germany, we value data protection and personal freedom highly. protect your data as you would protect your reputation. be critical about giving out information on the internet. #dataprivacy""",de
457,mixtral,"""in deutschland, wir nehmen datenschutz ernst! schütze deine persönlichen daten und sei vorsichtig, wem du sie anvertraust. #datenschutz #persönlicheinformationen""

translation: ""in germany, we take data privacy seriously! protect your personal data and be careful who you entrust it to. #dataprivacy #personalinformation""",de
458,mixtral,"""in deutschland legen wir großen wert auf datenschutz und privatsphäre. es ist wichtig, unsere persönlichen daten zu schützen und bewusst mit ihnen umzugehen. denkt daran, eure privatsphäreeinstellungen zu überprüfen und nur das zu teilen, was ihr auch wirklich preisgeben möchtet. #datenschutz #privatsphäre""

translation: ""in germany, we value data protection and privacy highly. it's important to protect our personal data and handle them with care. remember to check your privacy settings and only share what you really want to disclose. #dataprotection #privacy""",de
459,mixtral,"""in deutschland, wir nehmen datenschutz ernst! schütze deine persönlichen daten online und sei kritisch gegenüber unternehmen, die nach ihnen fragen. #datenschützen""

translation: ""in germany, we take data privacy seriously! protect your personal data online and be critical of companies that ask for it. #dataprotection""",de
460,mixtral,"""in deutschland legen wir wert auf datenschutz! schütze deine persönlichen informationen und sei achtsam bei ihrer weitergabe online. #datenschutz #persönlicheinformationen""

translation: ""in germany, we value data privacy! protect your personal information and be mindful of its dissemination online. #dataprivacy #personalinformation""",de
461,mixtral,"""in deutschland, wir nehmen datenschutz ernst! schütze deine persönlichen daten und sei vorsichtig mit wem du sie teilst. #datenschutz""

translation: ""in germany, we take data privacy seriously! protect your personal information and be careful who you share it with. #dataprotection""",de
462,mixtral,"""in deutschland, wir nehmen datenschutz ernst! schütze deine persönlichen daten und sei vorsichtig bei deren freigabe online. #datenschützen #privatsphäre""

translation: ""in germany, we take data privacy seriously! protect your personal information and be cautious when sharing it online. #dataprotection #privacy""",de
463,mixtral,"""in deutschland, wir schützen unsere persönlichen daten ernsthaft. kein unternehmen sollte ohne zustimmung auf ihre informationen zugreifen dürfen. #datenschutz #persönlicherechte""

translation: ""in germany, we take the protection of our personal data seriously. no company should be allowed to access your information without consent. #dataprotection #personalrights""",de
464,mixtral,"""in deutschland legen wir großen wert auf datenschutz. schütze deine persönlichen daten und überdenke, was du online teilst. #datenschutz #persönlicheinformationen""

(""in germany we value data privacy highly. protect your personal data and think twice about what you share online. #dataprotection #personalinformation"")",de
465,mixtral,"""in deutschland legen wir großen wert auf datenschutz. schütze deine persönlichen daten online wie in der realen welt. sei kritisch und informiert! #datenschutz""

translation: ""in germany, we value privacy protection. protect your personal data online as you would in the real world. be critical and informed! #datenschutz""",de
466,mixtral,"""in deutschland schützen wir sorgfältig unsere persönlichen daten und respektieren die privatsphäre anderer. im digitalen zeitalter ist dies wichtiger denn je! #datenschutz""

translation: ""in germany, we carefully protect our personal data and respect privacy. in the digital age, this is more important than ever! #dataprivacy""",de
467,mixtral,"""in deutschland, wir schützen sorgfältig unsere persönlichen daten und respektieren die privatsphäre anderer. es ist wichtig, dass wir alle achtsam mit unseren informationen umgehen. #datenschutz""

translation: ""in germany, we carefully protect our personal data and respect privacy of others. it is important that we all handle our information mindfully. #dataprivacy""",de
468,mixtral,"""in deutschland schützen wir sorgfältig unsere persönlichen daten. kein unternehmen sollte unser recht auf #datenschutz verletzen. seid wachsam und informiert euch über eure privatsphäre-einstellungen! #datensindgeheimnis""

translation: ""in germany, we carefully protect our personal data. no company should violate our right to #dataprivacy. stay vigilant and educate yourself about your privacy settings! #dataaresecret""",de
469,mixtral,"""in deutschland legen wir großen wert auf datenschutz! unsere persönlichen informationen sind kostbar und sollten geschützt werden. vergesst nicht, eure privatsphäre-einstellungen zu überprüfen und nur vertrauenswürdigen quellen eure daten anzuvertrauen. #datenschutz #persönlicheinformationen""

translation: ""in germany, we value data privacy highly! our personal information is valuable and should be protected. don't forget to check your privacy settings and only entrust your data to trustworthy sources. #dataprivacy #personalinformation""",de
470,mixtral,"""in deutschland schützen wir sorgfältig unsere persönlichen daten. lasst uns auch online darauf achten, wen wir unseren informationen anvertrauen. #datenschutz""

translation: ""in germany, we carefully protect our personal data. let us also pay attention to whom we entrust our information online. #dataprivacy""",de
471,mixtral,"""in deutschland, wir nehmen datenschutz ernst! schütze deine persönlichen daten online und sei vorsichtig, wem du sie anvertraust. #datenschützen""

translation: ""in germany, we take data privacy seriously! protect your personal information online and be careful who you entrust it to. #dataprotection""",de
472,qwen,"""datenschutz oder überwachung? unsere persönlichen informationen müssen geschützt werden, aber wodrawir die grenze ziehen? #datenschutz #privatsphäre""",de
473,qwen,"""datenschutz ist mehr als ein trend - es schützt unsere identität und privatsphäre. jeder von uns muss aufmerksam sein, was wir online teilen. #datenschutz #privacymatters""",de
474,qwen,"""datenschutz oder überwachung? unsere persönlichen informationen müssen besser geschützt werden! # datenschutz #persönlichkeitsrechte""",de
475,qwen,"""datenschutz oder überwachung? unsere persönlichen informationen sollten stets geschützt sein, aber wo liegt die grenze zwischen privatsphäre und sicherheit? 🕵️‍♂️🔒 # datenschutz #privatsphäre""",de
476,qwen,""" datenprivacy matters! warum geben wir unsere persönlichen informationen ohne genügend schutz预? 🤔🔒 #privacyrights""",de
477,qwen,""" datenprivatsphäre ist mehr als nur ein trend - es ist die grundlage unserer persönlichen freiheit. schützen wir unsere informationen und fordern wir strengere regulierungen! #datenprivacy #persönlichefreiheit""",de
478,qwen,"""data privacy matters! ist es nicht high time, dass wir unsere persönlichen informationen besser schützen? #datenschutz #privacyrights""",de
479,qwen,"""datenschutz ist mehr als ein trend - es ist die grundlage unserer privatsphäre. 💻🔒 wer kontrolliert wirklich unsere daten? #datenschutz #privatsphäre""",de
480,qwen,"""datenschutz ist mehr als ein trend. unsere persönlichen informationen sollten immer geschützt sein.批判isch denken: ist unser datenverkehr wirklich so sicher wie uns geheißen wird? #datenschutz #kritischerdenk""",de
481,qwen,"""wir brauchen echte datensicherheit! aber sind unsere informationen wirklich geschützt? 🤔🔒 #datenschutz #kritik""",de
482,qwen,"""datenschutz ist mehr als ein trend - es schützt unsere identität und privatsphäre. lassen sie uns kritisch nachdenken, wie wir unsere daten besser schützen können! #datenschutz #privacymatters""",de
483,qwen,""" datenprivatsphäre: unser recht auf schutz persönlicher informationen. aber wie sicher sind wir wirklich online? 🌐🔒 #datenschutz #privacyconcerns""",de
484,qwen,"""wir müssen überprüfen, wie unsere persönlichen daten geschützt werden. data privacy - kein luxus, sondern ein grundlegender recht!"" #datenschutz #privacymatters",de
485,qwen,"""datenschutz oder überwachung? unsere persönlichen informationen sind wertvoller als je zuvor. aber auf welche kosten? 🤔🔒 # datenschutz #_privacyrights""",de
486,qwen,""" datenschutz nicht nur ein wort, sondern unser recht auf privatsphäre. ist es nicht an der zeit, strengere regeln durchzusetzen? #datenprivacy #privatsphärerecht""",de
487,qwen,"""datenschutz oder überwachung? unsere persönlichen informationen brauchen echten schutz! #datensicherheit #_privacyrights""",de
488,qwen,"""datenschutz ist mehr als ein trend - es ist die grundlage unserer privatsphäre. jeder beitrag, jeder like - sie alle hinterlassen spuren. die frage ist: wer kontrolliert die kontrolleure? #datensicherheit #privacymatters""",de
489,qwen,"""datenschutz ist mehr als ein trend - es schützt unsere identität und privatsphäre. fragt euch, wer zugriff auf eure daten hat und seid vorsichtig mit der preisgabe von persönlichen informationen. #datenschutz #privacymatters""",de
490,qwen,"""data privacy matters! ist es wirklich noch sicher, unsere persönlichen informationen im digitalen reich zu teilen? #datenschutz #privacyconcerns""",de
491,qwen,""" datenprivacy 🛡️ wirklich alle wissen wollen, was wir unterwegs sind? zeit für strengere regeln! #dataprotection #privacyrights """,de
492,qwen,"""datenschutz ist mehr als nur ein trend. unsere persönlichen informationen müssen wie edelsteine behandelt werden - geschützt vor neugierigen augen und missbräuchlicher nutzung. #datensicherheit #privatsphäre""",de
493,qwen,"""datenschutz ist mehr als ein trend - es schützt unsere identität und privatsphäre. fragt euch, wer zugriff auf eure daten hat! #datenschutz #privatsphäre""",de
494,qwen,"""datenschutz ist mehr als ein trend - es ist die grundlage für unser digitales privatleben. #datensicherheit #privacymatters""",de
495,qwen,"""datenschutz ist mehr als ein trend - es schützt unsere identität im digitalen zeitalter. aber fragt euch: ist unser persönliches information wirklich sicher? #datenschutz #criticalthinker""",de
496,qwen,""" datenprivacy 🕵️‍♂️ wie viel kontrolle haben wir wirklich über unsere persönlichen informationen? #dataprotection #privacyrights """,de
497,qwen,""" datenprivatsphäre ist wichtiger denn je! aber fragt sich, wie wir unser persönliches information wirklich schützen können. #datenschutz #criticalthinking""",de
498,qwen,"""datenschutz oder überwachung? unser recht auf privates leben muss online gleichermaßen geschützt werden. 💻🔒 #datenschutz #privacymatters""",de
499,qwen,"""data privacy matters! 🛡️ wie schützen wir uns effektiv vor datenmissbrauch? #datenschutz #privacyconcerns""",de
500,qwen,"""datenschutz ist mehr als ein trend - es beschützt unsere persönlichen informationen. aber wie können wir sicherstellen, dass unser datenverkehr wirklich privat bleibt? #datenschutz #privatsphäre""",de
501,qwen,""" datenprivatheit: unsere persönlichen informationen sind wie gold - es zeit ist, sie besser zu schützen! #datensicherheit #privatsphäre """,de
502,qwen,"""datenschutz ist mehr als ein trend - es ist die grundlage unserer privatsphäre. fragt euch, wer zugriff auf eure daten hat und seid vorsichtig mit der preisgabe persönlicher informationen. #datenschutz #privatsphäre""",de
503,qwen,"""datenschutz ist mehr als ein trend - es schützt unsere identität und privatsphäre. aber wie sicher sind wir wirklich, wenn unternehmen immer mehr daten sammeln? #datenschutz #privatsphäre #critique""",de
504,qwen,"""datenschutz ist mehr als ein trend - es schützt unsere persönlichen informationen. aber fragt sich, wie gut sind wirreally vor datenmissbrauch geschützt? #datenschutz #critique""",de
505,qwen,"""wir reden viel über datenschutz, aber wie sicher ist unsere persönlichen information wirklich? 🤔🔒 #datenschutz #privatsphäre""",de
506,qwen,"""data privacy, ein echter kampf! unsere persönlichen informationen sollten stets geschützt sein. aber wie finden wir den richtigen balance zwischen nutzen und sicherheit? #datenschutz #persönlicheinformationen""",de
507,qwen,"""data privacy matters! aber wissen wir wirklich, wie unsere persönlichen informationen geschützt werden? zeit für mehr transparenz und kontrolle über unseren eigenen daten-schatz. #datenschutz #transparenz""",de
508,qwen,"""datenschutz ist mehr als ein trend - es schützt unsere identität und privatsphäre. aber fragt euch: ist unser persönliches information wirklich sicher? #datenschutz #privacyconcerns""",de
509,qwen,"""datenschutz ist mehr als ein trend - es schützt unsere identität und privatsphäre. wessen daten sind sie wirklich? #datenschutz #privatsphäre""",de
510,qwen,"""datenschutz oder überwachung? unsere persönlichen informationen sollten stets geschützt sein, aber wo draw die linie? 📈🔒 #datenschutz #privacymatters""",de
511,qwen,"""datenschutz ist mehr als ein trend - es schützt unsere persönlichen informationen. aber wie sicher sind wir wirklich online? 💻🔒 # datenschutz #persönlicheinformationen""",de
512,qwen,"""data privacy matters! 🌐🔒 wer seine persönlichen informationen schützen möchte, sollte sich über datenverarbeitung informieren. kritisch denken und unser recht auf privatsphäre wahren! #datenschutz #privacyrights""",de
513,qwen,"""datenschutz ist mehr als ein trend - es ist die grundlage unserer privatsphäre. wer kontrolliert, wer信息 hat."" #datenschutz #privatsphäre",de
514,qwen,""" datenschutz nicht nur ein wort, sondern unsere_privatheit! warum geben wir noch immer so viel个人信息preis? 🤔🔒 #datenschutz #privacymatters""",de
515,qwen,"""data privacy ist mehr als ein trend - es ist die schutzmaßnahme für unsere persönlichen informationen. jeder von uns sollte kritisch überlegen, wie und mit wem wir unsere daten teilen. #datenschutz #persönlichkeitsrechte""",de
516,qwen,"""datenschutz oder überwachung? unsere persönlichen informationen sollten stets geschützt sein, aber wie weit går das recht auf privatsphäre? 🕵️‍♂️🔒 #datenschutz #privacymatters""",de
517,qwen,"""datenschutz ist mehr als nur ein wort - es schützt unsere identität und privatsphäre. aber wie sicher sind wirklich unsere daten? 🤔🔒 #datenschutz #privacymatters""",de
518,qwen,"""datenschutz oder überwachung? unsere persönlichen informationen brauchen echte schutzmaßnahmen! #datenschutz #privacymatters""",de
519,qwen,""" daten_privatheit - warum das schützen unserer persönlichen informationen mehr denn je wichtig ist. #datenschutz #privacymatters""",de
520,qwen,"""datenschutz ist mehr als ein trend - es schützt unsere identität und privatsphäre. fragt euch, wer zugriff auf eure daten hat und seid vorsichtig mit dem, was ihr online teilt. #datenschutz #privatsphäre""",de
521,qwen,"""wir brauchen echte datensicherheit! aber warnung: jede app, jeder click kann dein privatsphäre beeinträchtigen. sei kritisch und schütze deine daten!"" #datenschutz #privatsphäre",de
522,qwen,""" daten privatsphäre - unser persönliches informationsschutz ist mehr denn je im fokus. aber fragt sich, sind unsere datenschutzgesetze wirklich ausreichend? #datenschutz #privacymatters """,de
523,qwen,"""datenschutz ist mehr als ein trend - es geht um die kontrolle über unser persönliches informationsgold. 💪🔒 #datensicherheit #_privacy""",de
524,qwen,"""datenschutz ist mehr als ein trend - es ist die grundlage unserer privatsphäre. 🛡️个人信息不是商品，保护它们是每个人的责任！ 💻知情同意应该是数据收集的黄金法则. #datenschutz #privatsphäre""",de
525,qwen,"""datenschutz oder überwachung? unsere persönlichen informationen brauchen echte schutzmaßnahmen, nicht nur lippenbekenntnisse. #datenschutz #privacymatters""",de
526,qwen,"""data privacy matters! 🌐🔒 wenn wir unsere persönlichen informationen nicht schützen, wer wird es dann tun? #datenschutz #privacyawareness""",de
527,qwen,"""data privacy matters! ist es nicht zeit, strenger gegen die missbrauch von persönlichen informationen vorzugehen? #datenschutz #privatsphäre""",de
528,qwen,"""datenschutz ist mehr als ein trend - es schützt unsere identität im digitalen zeitalter. aber wie können wir sicherstellen, dass unsere persönlichen daten wirklich geschützt sind? #datenschutz #privacymatters""",de
529,qwen,"""🚨 datenintegrität matters! 🚨 wieso müssen wir ständig nachweisen, dass unsere persönlichen informationen sicher sind? der schutz unserer daten sollte ein grundrecht sein! 💻🛡️ #datenschutz #rechtaufprivatsphäre""",de
530,qwen,"""datenschutz ist mehr als ein trend - es ist die grundlage unserer privatsphäre. weshalb sollten wir nicht mehr über unsere datenbestände wissen? #datenschutz #privacymatters""",de
531,qwen,""" daten_privatheit: warum der schutz unserer persönlichen informationen mehr denn je counts! #datenschutz #privacymatters""",de
532,qwen,""" persoanlichen daten? wirklich sicher oder ein illusionshaftes gefühl der privatsphäre? 🤔🔒 #datenschutz""",de
533,qwen,"""datenschutz oder überwachung? unsere persönlichen informationen sind stärker denn je im fokus. aber bis zu welchen grenzen sollten wir akzeptieren? # datenschutz # persönlicheinformationen # grenzendesakkords""",de
534,qwen,""" datenschutz ist mehr als ein trend - es ist die grundlage für unser digitales leben. ⚠️ #datenschutz #privacymatters""",de
535,qwen,""" perso#nlichkeitsrechte digitaler zeiten 💾何处是隐私の边界? 🧭 #datenschutzcrisis """,de
536,qwen,"""datenschutz ist mehr als ein trend - es schützt unsere persönlichen informationen. aber wie sicher sind wir wirklich, solange unternehmen daten wie oil behandeln? #datensicherheit #privatsphäre""",de
537,qwen,"""data privacy matters! 🌐🔒 wir müssen kritisch über den schutz unserer persönlichen informationen nachdenken. #datenschutz #privacy""",de
538,qwen,"""data privacy matters! 🌐🔒 wer seine persönlichen informationen schützen will, sollte sich intensiv mit den themen datenschutz und datensicherheit auseinandersetzen. nur so können wir gegen die sicheren datenraum auflösenden kräfte bestehen. 💪 #datenschutz #个人信息保护""",de
539,qwen,"""datenschutz ist mehr als ein trend - es schützt unsere identität und persönliche informationen. fragt euch, wer zugriff auf eure daten hat! #datenschutz #privatsphäre""",de
540,qwen,"""datenschutz oder überwachung? unsere persönlichen informationen brauchen echte schutzmaßnahmen!"" # datenschutz #personendaten",de
541,qwen,"""datenschutz ist mehr als ein trend - es schützt unsere identität und privatsphäre. fragt euch, was actually unternehmen mit euren daten machen... #datenschutz #privacymatters""",de
542,qwen,""" datenschutz ist mehr als ein hashtag. unsere persönlichen informationen müssen besser geschützt werden! 💻🔒 #datenschutz #privacymatters""",de
543,qwen,"""data privacy matters! 🛡️ wie können wir besser unsere persönlichen informationen schützen? 💭 #datenschutz #privacyconcerns""",de
544,qwen,"""datenschutz oder überwachung? die schutzeigenschaften unserer persönlichen daten sollten nicht auf opferstatus degradiert werden. # datenschutz # persönlichedaten""",de
545,qwen,""" datenprivacy 🛡️ wahrlich, unsere persönlichen informationen brauchen schutz! aber fragt sich, wie gut sind unsere aktuellen datenschutzmaßnahmen? 🤔 #dataprotection #privacyrights """,de
546,qwen,"""data privacy matters! ist es nicht诡异, wie unser persönliches information geschützt wird? 🤔🔒 #datenschutz #privacyconcerns""",de
547,qwen,"""datenschutz ist mehr als ein trend - es schützt unsere identität und privatsphäre. lasst uns kritisch prüfen, wie gut wir tatsächlich unsere daten schützen. #datenschutz #privacymatters""",de
